id,testo,classe
14_3/00595,"- premesso che: la perdurante mancanza di precipitazioni atmosferiche di queste settimane viene considerata la causa dell'innalzamento del livelli dl sostanze inquinanti in molte citta' italiane, in particolare le polveri sottili (Pm 10), monossido di carbonio e biossido di azoto; la situazione di emergenza, derivante dalla continua immissione in atmosfera di gas di scarico dei veicoli e degli impianti di riscaldamento la cui concentrazione non e' stata mitigata dalla pioggia e dal vento, ha messo in allarme le amministrazioni locali in molte citta' d'Italia; gli interventi proposti appaiono tardivi, poco efficaci e limitati alla sola gestione dell'emergenza, mentre il problema dell'inquinamento atmosferico e degli effetti dannosi per la salute dei cittadini sono noti da tempo; da tempo l'Organizzazione mondiale della sanita' fornisce stime e dati sull'incidenza degli agenti inquinanti sulle malattie respiratorie e cardiovascolari, chiedendo drastici interventi per la soluzione dal problema; i soggetti maggiormente danneggiati da questa assurda situazione sono quelli piu' deboli, anziani e bambini, ai quali e' di fatto preclusa la possibilita' di uscire dalla propria abitazione senza andare incontro a pericolose conseguenze; e' necessario e non derogabile modificare le strategie di mobilita' urbana, ponendo in essere misure per la riduzione dell'uso del mezzo privato e per il potenziamento dei sistemi di trasporto pubblico e quelli a basso impatto ambientale; gli studi del ministero dell'ambiente e della tutela del territorio sulla mobilita' sostenibile forniscono, gia' da ora, indicazioni precise sulle misure da adottare a medio e lungo termine a tutela della salute dei cittadini e per il miglioramento della qualita' della mobilita' e della vita nelle aree urbane; la legge finanziaria approvata dal Governo non sembra fornire adeguate risorse agli interventi necessari, con modesti stanziamenti per la legge sul trasporto rapido di massa e per la mobilita' ciclistica; gli atti del Governo in materia di infrastrutture e trasporti emanati fino ad ora sembrano voler proseguire una politica della mobilita' che privilegia il trasporto su gomma rispetto alle modalita' meno inquinanti -: quali interventi intenda adottare il Ministro interrogato per garantire a tutti i cittadini il diritto alla salute, sancito dalla Costituzione come diritto fondamentale e che non puo' essere messo in secondo piano rispetto ad altre esigenze. (3-00595)",10
14_3/00480,- premesso che: in sedi quali il comitato della bioetica e da associazioni come il movimento per la vita viene sostenuta la tesi del riconoscimento dell'embrione come soggetto autonomo di diritto -: se il Governo non ritenga che tale riconoscimento sia lesivo del principio giuridico che attribuisce alla donna la responsabilita' della scelta di maternita' e rechi con se' il rischio di una rimessione in discussione di una legge dello Stato quale la n. 194 del 1978.(3-00480),2
13_3/01697,- premesso che: i recenti fatti di cronaca evidenziano la drammaticita' del problema relativo alla violenza sui minori; la citata drammaticita' richiede immediati interventi legislativi; quali urgenti provvedimenti il Governo intenda adottare per rispondere alle attese dell'opinione pubblica sempre piu' inquieta. (3-01697),12
16_3/01292,"- premesso che: il mondo dell'autotrasporto si muove tutti i giorni (365 giorni all'anno per alcune tipologie di trasporto) sulle nostre strade; si tratta di un settore composto principalmente da un notevolissimo numero di conducenti di automezzi, che si relaziona, pero', con gli agenti della polizia stradale e gli altri organi di controllo che giornalmente vigilano sulla sicurezza della circolazione di tutti i cittadini; tutti gli operatori del settore (trasportatori e istituzioni) gia' sanno: i controlli sono per la maggior parte indirizzati verso le aziende italiane; basti pensare che nel 2009 solo il 6 per cento dei controlli sui veicoli merci, effettuati con impiego dei centri mobili di revisione, ha interessato veicoli extracomunitari e per il 25 per cento veicoli comunitari (non italiani); altro problema che risulta da un confronto tra operatori e' che i controlli sono concentrati in maniera particolare in alcune zone o regioni d'Italia, con un'evidente penalizzazione per chi opera in questi territori; la differenziazione relativa al numero di controlli effettuato nelle varie zone del Paese comporta l'insorgere di una concorrenza sleale nei confronti delle aziende che operano correttamente; il minore numero di controlli nei confronti di trasportatori stranieri, comunitari ed extracomunitari, ed italiani in particolari zone del Paese comporta anche un rischio per gli utenti della strada, considerato il rischio che si viaggi con mezzi sovraccarichi, non in regola o con turni di guida piu' lunghi del dovuto -: se il Ministro interrogato, essendo a conoscenza dei dati relativi ai controlli sugli automezzi e la loro localizzazione sul territorio nazionale, non intenda intervenire al fine di distribuire in modo omogeneo le attivita' ispettive, sia nei confronti degli autotrasportatori stranieri sia nelle zone dove statisticamente sono inferiori. (3-01292)",10
17_3/03134," premesso che: il 9 aprile 2015 un uomo, eludendo tutti i controlli, è entrato armato nel palazzo di giustizia di Milano e ha ucciso tre persone e ferito gravemente altre due. Vennero uccisi il giudice Fernando Ciampi, l'avvocato Lorenzo Claris Appiani ed il signor Giorgio Erba; il fatto suscitò un'ondata di commozione e di cordoglio, ma anche indignazione e preoccupazione per la scarsa sicurezza del tribunale di Milano; mentre l'assassino è stato preso e condannato all'ergastolo, per quanto riguarda l'ingresso dell'arma la procura della Repubblica ha indagato esclusivamente il vigilante addetto al tunnel radiogeno apposto al varco cui passò l'assassino, imputandogli di non aver visto l'arma nella borsa, mentre passava nel tunnel ; da tutti gli elementi raccolti nel processo contro il vigilante è emersa la completa assenza di prove sulla responsabilità dell'imputato, che è stato assolto da ogni accusa nel maggio 2017. Viceversa si è palesato un sistema di sicurezza «sottovalutato e definito solo per approssimazione», come ha ricordato la procura di Brescia al termine delle indagini. Nello specifico: metal-detector vecchi e poco revisionati, immagini delle telecamere di controllo di scarsa qualità, addetti ai controlli degli istituti di vigilanza che hanno l'appalto poco istruiti su come controllare e su cosa fare in caso di pericolo; dalla lettura delle osservazioni della procura di Brescia si può desumere che tutte le persone che dovevano farsi carico del sistema di sicurezza, posto a sua volta sotto il controllo di una commissione di manutenzione composta dalle più alte cariche del tribunale, poco hanno fatto, nel periodo precedente il 9 aprile 2015, per eliminare la trascuratezza, l'inaffidabilità, l'impreparazione e la negligenza evidenziata&#8211;: se a livello di indagini interne siano state individuate le responsabilità della trascuratezza e della negligenza nei controlli e quali misure abbia adottato o intenda adottare per garantire la sicurezza delle migliaia di persone che quotidianamente frequentano il tribunale di Milano. (3-03134)",12
